{
  "$schema": "https://json-schema.org/draft/2020-12/schema",
  "title": "Skolyoz benchmark run",
  "type": "object",
  "required": ["schema_version", "kind", "created_utc", "environment", "config", "results", "notes"],
  "properties": {
    "schema_version": {"const": 1},
    "kind": {"enum": ["arch", "tflite"]},
    "created_utc": {"type": "string", "pattern": "^\\d{4}-\\d{2}-\\d{2}T\\d{2}:\\d{2}:\\d{2}Z$"},
    "environment": {
      "type": "object",
      "required": ["os", "cpu", "logical_cores", "python"],
      "properties": {
        "os": {"type": "string"}, "machine": {"type": "string"}, "cpu": {"type": "string"},
        "logical_cores": {"type": ["integer", "null"]}, "python": {"type": "string"},
        "commit": {"type": ["string", "null"]}, "torch": {"type": "string"},
        "cuda_device": {"type": ["string", "null"]}, "tflite_runtime": {"type": "string"}
      }
    },
    "config": {
      "type": "object",
      "required": ["threads", "warmup", "repeat", "input"],
      "properties": {
        "threads": {"type": "integer", "minimum": 1}, "warmup": {"type": "integer", "minimum": 0},
        "repeat": {"type": "integer", "minimum": 1}, "input": {"const": "synthetic"}
      }
    },
    "results": {
      "type": "array",
      "minItems": 1,
      "items": {
        "type": "object",
        "required": ["name", "device", "latency_ms"],
        "properties": {
          "name": {"enum": ["stage1", "stage2", "pipeline"]},
          "device": {"type": "string"},
          "params": {"type": "integer"}, "gflops": {"type": "number"},
          "input_shape": {"type": ["array", "null"], "items": {"type": "integer"}},
          "latency_ms": {
            "type": "object",
            "required": ["n", "min", "mean", "std", "p50", "p90", "p95", "p99", "max"],
            "additionalProperties": {"type": "number"}
          }
        }
      }
    },
    "notes": {"type": "array", "items": {"type": "string"}}
  }
}
